{
  "version": "1.0.0",
  "receipt_id": "rcpt_01JB0000000000000000000001",
  "job_id": "job_01JB0000000000000000000001",
  "issued_at": "2026-10-17T10:00:00Z",
  "policy_version": "dpdp-2023-v1.4",
  "subject_commitment": "66a73396e6981b23597612f4a44c19b3bcd5692d4ef2232213415a24c733b2f0",
  "pre_root": "690dcb517c3e309c5b9c03dc53ddce9a2f26fc1aac8ffd32a54ea39803494e15",
  "post_root": "025b637c96cba7f50cbf247092135c33945f5fc61a5b4062c6e96825f33068d3",
  "diff_root": "65b5f69ab8cb10381aa6d12f92cf52fb0040e7f5e04e6f74873fb1b3e2b429fa",
  "leaf_counts": {
    "iceberg": 2,
    "vector": 1,
    "cache": 1,
    "relational": 1,
    "total": 5
  },
  "items_erased_counts": {
    "iceberg": 2,
    "vector": 1,
    "cache": 1,
    "relational": 0,
    "total": 4
  },
  "retention_holds": [
    {
      "category": "kyc_documents",
      "legal_basis": "PMLA 2002 / RBI KYC Master Direction 2016 (5-year statutory lock)",
      "release_date": "2031-10-17T10:00:00Z",
      "count": 1
    }
  ],
  "audit_summary": {
    "attacks_run": 9,
    "attacks_passed": 9,
    "remediation_rounds": 1,
    "collateral_integrity": true
  },
  "algorithm_descriptors": {
    "hash_func": "SHA-256",
    "leaf_domain_separator": "0x00",
    "node_domain_separator": "0x01",
    "signature_scheme": "Ed25519"
  },
  "anchor": {
    "network": "ShipRite-AnchorNet",
    "tx_hash": "0x4f83b128562d965e648b712b774d02633091df05c2a07c244b7d510df1ca7a20",
    "block": 4829104,
    "target": "0x742d35Cc6634C0532925a3b844Bc454e4438f44e",
    "explorer_url": "https://explorer.shiprite.io/tx/0x4f83b128562d965e648b712b774d02633091df05c2a07c244b7d510df1ca7a20",
    "status": "CONFIRMED"
  },
  "signer_public_key": "d75a980182b10ab7d54bfed3c964073a0ee172f3daa62325af021a68f707511a",
  "signature": "5ac6e3d42d37290ae8cd98d55f5a2de38d7255cf6515792c3e594bf5b2b3299ee10929e4ec166d70d9bde01f7a84f91d83c6503dfbaf7b7b9b821163eebbed0c"
}